{
  "schema_version": 1,
  "task_id": "S03",
  "started_at": "2026-08-09T09:41:26.955180+00:00",
  "finished_at": "2026-08-09T09:43:52.792809+00:00",
  "status": "pass",
  "git_commit": "834b223c929b70d42f24a074ce49db252ab969ca",
  "sources": [
    {
      "url": "artifacts/model/h40m/expert_arena.layout.json",
      "ref": "M02 expert_arena layout committed in 1c47a429",
      "note": "S03 H40M slot size 13,236,480 bytes and arena alignment 1,048,576 bytes come from the M02 H40M expert layout."
    }
  ],
  "commands": [
    {
      "argv": "'C:\\msys64\\ucrt64\\bin\\g++.exe' -std=c++20 -Wall -Wextra -Wpedantic -I 'device\\runtime\\include' 'tests\\expert_cache_policy_test.cpp' 'device\\runtime\\src\\expert_cache.cpp' 'device\\runtime\\src\\ram_arena.cpp' -o 'artifacts\\runs\\20260809T094126Z_S03\\expert_cache_policy_test.exe'",
      "exit_code": 0,
      "stdout_file": "artifacts\\runs\\20260809T094126Z_S03\\stdout\\001.log",
      "stderr_file": "artifacts\\runs\\20260809T094126Z_S03\\stderr\\001.log"
    },
    {
      "argv": "'artifacts\\runs\\20260809T094126Z_S03\\expert_cache_policy_test.exe' 'benchmarks\\custom\\expert_cache.json'",
      "exit_code": 0,
      "stdout_file": "artifacts\\runs\\20260809T094126Z_S03\\stdout\\002.log",
      "stderr_file": "artifacts\\runs\\20260809T094126Z_S03\\stderr\\002.log"
    },
    {
      "argv": "python -m json.tool 'benchmarks\\custom\\expert_cache.json'",
      "exit_code": 0,
      "stdout_file": "artifacts\\runs\\20260809T094126Z_S03\\stdout\\003.log",
      "stderr_file": "artifacts\\runs\\20260809T094126Z_S03\\stderr\\003.log"
    },
    {
      "argv": "'C:\\Program Files\\CMake\\bin\\cmake.exe' --build build --config Release -j 4",
      "exit_code": 0,
      "stdout_file": "artifacts\\runs\\20260809T094126Z_S03\\stdout\\004.log",
      "stderr_file": "artifacts\\runs\\20260809T094126Z_S03\\stderr\\004.log"
    },
    {
      "argv": "'C:\\Program Files\\CMake\\bin\\ctest.exe' --test-dir build --output-on-failure",
      "exit_code": 0,
      "stdout_file": "artifacts\\runs\\20260809T094126Z_S03\\stdout\\005.log",
      "stderr_file": "artifacts\\runs\\20260809T094126Z_S03\\stderr\\005.log"
    }
  ],
  "files_changed": [
    "PROJECT_STATE.yaml",
    "artifacts/runs/20260809T094126Z_S03/",
    "benchmarks/custom/expert_cache.json",
    "device/runtime/include/h40/expert_cache.hpp",
    "device/runtime/src/expert_cache.cpp",
    "device/runtime/src/ram_arena.cpp",
    "tests/expert_cache_policy_test.cpp"
  ],
  "verification": [
    {
      "name": "Deterministic cache policy tests.",
      "passed": true,
      "detail": "expert_cache_policy_test passed fixed LRU sequence checks: 1 hit, 5 misses, 2 evictions, exact provider bytes, packed default slots, and H40M-sized slots with 1 MiB-aligned stride."
    },
    {
      "name": "Long churn test proves used_bytes never exceeds budget.",
      "passed": true,
      "detail": "The 1,000-request deterministic churn test matched an independent LRU simulator exactly: hits=224, misses=776, evictions=772, bytes_loaded=794,624, peak_used_bytes=4,096, budget=4,096, with used_bytes checked after every request."
    }
  ],
  "metrics": {
    "churn_requests": 1000,
    "churn_peak_used_bytes": 4096,
    "churn_evictions": 772,
    "h40m_slot_stride_bytes": 13631488,
    "h40m_peak_used_bytes": 39709440
  },
  "artifacts": [
    "benchmarks\\custom\\expert_cache.json",
    "tests\\expert_cache_policy_test.cpp",
    "artifacts\\runs\\20260809T094126Z_S03\\expert_cache_policy_test.exe"
  ],
  "limitations": [],
  "notes": []
}
